{
  "generatedAt": "2026-05-06T13:34:09.190Z",
  "source": {
    "notesIndexPath": "data/notes-index.json",
    "noteCount": 49
  },
  "entities": {
    "project": [
      {
        "id": "project-bikerinstinct",
        "name": "Bikerinstinct",
        "title": "Bikerinstinct",
        "noteIds": [
          "note-content-notes-2026-profound-projects-bikerinstinct-26-4-25-15"
        ],
        "priorityScore": 29,
        "status": "active",
        "metadata": {
          "noteCount": 1,
          "datedNoteCount": 1,
          "latestDate": "2026-04-25"
        }
      },
      {
        "id": "project-bv",
        "name": "BV",
        "title": "BV",
        "noteIds": [
          "note-content-notes-2026-profound-projects-bv-cbr-16",
          "note-content-notes-2026-profound-projects-bv-mz3-17"
        ],
        "priorityScore": 8,
        "status": "active",
        "metadata": {
          "noteCount": 2,
          "datedNoteCount": 0,
          "latestDate": null
        }
      },
      {
        "id": "project-cm4",
        "name": "CM4",
        "title": "CM4",
        "noteIds": [
          "note-content-notes-2026-profound-projects-cm4-print-18"
        ],
        "priorityScore": 4,
        "status": "active",
        "metadata": {
          "noteCount": 1,
          "datedNoteCount": 0,
          "latestDate": null
        }
      },
      {
        "id": "project-cshop",
        "name": "CSHOP",
        "title": "CSHOP",
        "noteIds": [
          "note-content-notes-2026-profound-projects-cshop-26-4-12-19",
          "note-content-notes-2026-profound-projects-cshop-26-4-25-20"
        ],
        "priorityScore": 42,
        "status": "active",
        "metadata": {
          "noteCount": 2,
          "datedNoteCount": 2,
          "latestDate": "2026-04-25"
        }
      },
      {
        "id": "project-dealinstinct",
        "name": "Dealinstinct",
        "title": "Dealinstinct",
        "noteIds": [
          "note-content-notes-2026-profound-projects-dealinstinct-26-4-25-21"
        ],
        "priorityScore": 29,
        "status": "active",
        "metadata": {
          "noteCount": 1,
          "datedNoteCount": 1,
          "latestDate": "2026-04-25"
        }
      },
      {
        "id": "project-examp-developer-portfolio",
        "name": "Examp. Developer Portfolio",
        "title": "Examp. Developer Portfolio",
        "noteIds": [
          "note-content-notes-2026-profound-projects-examp-developer-portfolio-wom-26-4-11-22",
          "note-content-notes-2026-profound-projects-examp-developer-portfolio-wom-26-4-25-23"
        ],
        "priorityScore": 42,
        "status": "active",
        "metadata": {
          "noteCount": 2,
          "datedNoteCount": 2,
          "latestDate": "2026-04-25"
        }
      },
      {
        "id": "project-flink3d",
        "name": "Flink3D",
        "title": "Flink3D",
        "noteIds": [
          "note-content-notes-2026-profound-projects-flink3d-26-4-25-24"
        ],
        "priorityScore": 32,
        "status": "active",
        "metadata": {
          "noteCount": 1,
          "datedNoteCount": 1,
          "latestDate": "2026-04-25"
        }
      },
      {
        "id": "project-fullstack-dev",
        "name": "Fullstack dev",
        "title": "Fullstack dev",
        "noteIds": [
          "note-content-notes-2026-profound-projects-fullstack-dev-26-4-1-25",
          "note-content-notes-2026-profound-projects-fullstack-dev-26-4-12-26",
          "note-content-notes-2026-profound-projects-fullstack-dev-temp-27"
        ],
        "priorityScore": 30,
        "status": "active",
        "metadata": {
          "noteCount": 3,
          "datedNoteCount": 2,
          "latestDate": "2026-04-12"
        }
      },
      {
        "id": "project-mucho3d",
        "name": "Mucho3D",
        "title": "Mucho3D",
        "noteIds": [
          "note-content-notes-2026-profound-projects-mucho3d-26-4-25-28"
        ],
        "priorityScore": 32,
        "status": "active",
        "metadata": {
          "noteCount": 1,
          "datedNoteCount": 1,
          "latestDate": "2026-04-25"
        }
      },
      {
        "id": "project-pf-project",
        "name": "PF-PROJECT",
        "title": "PF-PROJECT",
        "noteIds": [
          "note-content-notes-2026-profound-projects-pf-project-bms-kb-30",
          "note-content-notes-2026-profound-projects-pf-project-26-4-28-31",
          "note-content-notes-2026-profound-projects-pf-project-26-5-2-32",
          "note-content-notes-2026-profound-projects-pf-project-26-5-3-33",
          "note-content-notes-2026-profound-projects-pf-project-gh100-powerfull-planning-tracking-34"
        ],
        "priorityScore": 68,
        "status": "active",
        "metadata": {
          "noteCount": 5,
          "datedNoteCount": 3,
          "latestDate": "2026-05-03"
        }
      },
      {
        "id": "project-powerframe",
        "name": "Powerframe",
        "title": "Powerframe",
        "noteIds": [
          "note-content-notes-2026-profound-projects-powerframe-26-4-11-35",
          "note-content-notes-2026-profound-projects-powerframe-26-4-25-36"
        ],
        "priorityScore": 42,
        "status": "active",
        "metadata": {
          "noteCount": 2,
          "datedNoteCount": 2,
          "latestDate": "2026-04-25"
        }
      },
      {
        "id": "project-powerstarter-azure",
        "name": "Powerstarter Azure",
        "title": "Powerstarter Azure",
        "noteIds": [
          "note-content-notes-2026-profound-projects-powerstarter-azure-26-4-10-37",
          "note-content-notes-2026-profound-projects-powerstarter-azure-26-4-11-38",
          "note-content-notes-2026-profound-projects-powerstarter-azure-26-4-25-39"
        ],
        "priorityScore": 52,
        "status": "active",
        "metadata": {
          "noteCount": 3,
          "datedNoteCount": 3,
          "latestDate": "2026-04-25"
        }
      },
      {
        "id": "project-sapient",
        "name": "Sapient",
        "title": "Sapient",
        "noteIds": [
          "note-content-notes-2026-profound-projects-sapient-26-4-16-40",
          "note-content-notes-2026-profound-projects-sapient-26-4-25-41"
        ],
        "priorityScore": 42,
        "status": "active",
        "metadata": {
          "noteCount": 2,
          "datedNoteCount": 2,
          "latestDate": "2026-04-25"
        }
      },
      {
        "id": "project-therockettree-app",
        "name": "TheRocketTree-App",
        "title": "TheRocketTree-App",
        "noteIds": [
          "note-content-notes-2026-profound-projects-therockettree-app-26-4-10-42",
          "note-content-notes-2026-profound-projects-therockettree-app-26-4-11-43",
          "note-content-notes-2026-profound-projects-therockettree-app-26-4-12-44",
          "note-content-notes-2026-profound-projects-therockettree-app-26-4-13-45",
          "note-content-notes-2026-profound-projects-therockettree-app-26-4-14-46",
          "note-content-notes-2026-profound-projects-therockettree-app-26-4-17-47",
          "note-content-notes-2026-profound-projects-therockettree-app-26-4-25-48"
        ],
        "priorityScore": 92,
        "status": "active",
        "metadata": {
          "noteCount": 7,
          "datedNoteCount": 7,
          "latestDate": "2026-04-25"
        }
      }
    ],
    "prompt": [
      {
        "id": "prompt-content-notes-2026-profound-projects-cshop-26-4-25",
        "title": "Prompt session 26.4.25 @",
        "projectId": "project-cshop",
        "noteId": "note-content-notes-2026-profound-projects-cshop-26-4-25-20",
        "sourcePath": "content/notes-2026/Profound Projects/CSHOP/26.4.25 @",
        "date": "2026-04-25",
        "status": "placeholder",
        "priorityScore": 10,
        "metadata": {
          "derivedFrom": "prompt-like filename marker"
        }
      },
      {
        "id": "prompt-content-notes-2026-profound-projects-examp-developer-portfolio-wom-26-4-25",
        "title": "Prompt session 26.4.25 @",
        "projectId": "project-examp-developer-portfolio",
        "noteId": "note-content-notes-2026-profound-projects-examp-developer-portfolio-wom-26-4-25-23",
        "sourcePath": "content/notes-2026/Profound Projects/Examp. Developer Portfolio/WOM/26.4.25 @",
        "date": "2026-04-25",
        "status": "placeholder",
        "priorityScore": 10,
        "metadata": {
          "derivedFrom": "prompt-like filename marker"
        }
      },
      {
        "id": "prompt-content-notes-2026-profound-projects-flink3d-26-4-25",
        "title": "Prompt session 26.4.25 @",
        "projectId": "project-flink3d",
        "noteId": "note-content-notes-2026-profound-projects-flink3d-26-4-25-24",
        "sourcePath": "content/notes-2026/Profound Projects/Flink3D/26.4.25 @",
        "date": "2026-04-25",
        "status": "placeholder",
        "priorityScore": 10,
        "metadata": {
          "derivedFrom": "prompt-like filename marker"
        }
      },
      {
        "id": "prompt-content-notes-2026-profound-projects-mucho3d-26-4-25",
        "title": "Prompt session 26.4.25 @",
        "projectId": "project-mucho3d",
        "noteId": "note-content-notes-2026-profound-projects-mucho3d-26-4-25-28",
        "sourcePath": "content/notes-2026/Profound Projects/Mucho3D/26.4.25 @",
        "date": "2026-04-25",
        "status": "placeholder",
        "priorityScore": 10,
        "metadata": {
          "derivedFrom": "prompt-like filename marker"
        }
      },
      {
        "id": "prompt-content-notes-2026-profound-projects-pf-project-26-5-3",
        "title": "Prompt session 26.5.3 @",
        "projectId": "project-pf-project",
        "noteId": "note-content-notes-2026-profound-projects-pf-project-26-5-3-33",
        "sourcePath": "content/notes-2026/Profound Projects/PF-PROJECT/26.5.3 @",
        "date": "2026-05-03",
        "status": "placeholder",